Title;Author;Price;Url
Новая Надежда. Секретная система омоложения;Трескова Н. М. ;550 р.;550 р.
Китайский массаж гуаша: скребок и нефритовый ролик д...;Дичковская Н. С. ;516 р.;516 р.
Кардиохирургический минимум для кардиологов;Шихвердиев Н. Н. ;5400 р.;5400 р.
Дыхательная гимнастика. Реабилитация при пневмонии и...;Собко И. А. ;218 р.;218 р.
Сила растительного питания. Японская оздоровительная...;Кода М. ;642 р.;642 р.
Жизнь на менопаузе. Как выжить среди приливов и бурь;Штайнке Д. ;612 р.;612 р.
Сертификат о профилактических прививках; ;54 р.;54 р.
Марафон здоровья: детокс организма, питание, массаж;Кичигин Е. Н. ;329 р.;329 р.
Японские советы для эффективной растяжки: превратите...; ;453 р.;453 р.
Японская программа красоты: массаж лица и секреты ст...; ;458 р.;458 р.
Не сдохни на диете;Грегер М. ;1254 р.;1254 р.
Эстетическое тейпирование. Эффективный способ естест...;Богатырев А. Д. ;438 р.;438 р.
Еда вместо болезней. Революционная система здоровья,...;Коул У. ;659 р.;659 р.
Долг сердца. Кардиохирург о цене ошибок;Шихвердиев Н. Н. ;508 р.;508 р.
Здоровый малыш. Самые частые детские болезни: симпто...;Комов Н. В. ;551 р.;551 р.
Я отлично вижу! Улучшаем зрение сами. Советы врача;Троицкая С. И. ;189 р.;189 р.
"Гимнастика ""ноль"". Японская система оздоровления";Исимура Т. ;545 р.;545 р.
Прямая спина и ровные ножки. Геометрия ранних лет;Ранюшкин А. С. ;515 р.;515 р.
Справочник педиатра. 4-е изд.;Шабалов Н. П. ;2519 р.;2519 р.
Календарь здоровья и долголетия по Божьеву на 2021 год;Божьев Е. Н. ;182 р.;182 р.
Лечение по Болотову на каждый день. Календарь на 202...;Болотов Б. В. ;128 р.;128 р.
Отеки, варикоз, тромбоз и другие болезни вен. Как ле...;Бутова К. Г. ;320 р.;320 р.
Японский anti-age массаж: идеальное лицо за 5 минут ...;Мори Т. ;458 р.;458 р.
Разыщи в себе радость;Травинка (Петрова) В. М. ;139 р.;139 р.
Дневник питания ребенка. От 0 до 3 лет;Большакова А. М. ;144 р.;144 р.
Стройность без диет. Психологические техники для пох...;Хорс М. А. ;523 р.;523 р.
Активное долголетие. Упражнения для крепкого здоровь...;Маматов А. С. ;119 р.;119 р.
Доктор Евгений Божьев советует. Как повысить иммунит...;Божьев Е. Н. ;182 р.;182 р.
Как победить бессонницу? Здоровый сон за 6 недель;Бузунов Р. В. ;804 р.;804 р.
Доктор Евгений Божьев советует. Зарядка на каждый день;Божьев Е. Н. ;;
Движение без боли. Легендарная система Фельденкрайза;Уайлдмен Ф. ;;
Доктор Евгений Божьев советует. Как самому избавитьс...;Божьев Е. Н. ;182 р.;182 р.
Тело может! Как контролировать, лечить и предотвраща...;Уинтерс Н. ;581 р.;581 р.
Искусство не стареть;Ханна Т. ;395 р.;395 р.
"Марафон ""Японская гимнастика"". Система занятий на 55...";Накаяма К. ;284 р.;284 р.
Доктор Евгений Божьев советует. Как самому вылечить ...;Божьев Е. Н. ;218 р.;218 р.
Очищение суставов;Рудницкая Л ;79 р.;79 р.
Медицинская карта пациента, получающего медицинскую ...; ;143 р.;143 р.
Семь причин для жизни. Записки женщины-реаниматолога;Эбби  И. ;299 р.;299 р.
Народный лечебник Болотова;Болотов Б. В. ;;
Держи его за руку. Истории о жизни, смерти и праве н...;Грин  Ф. ;299 р.;299 р.
Японская система омоложения. 114 лайфхаков;Хибино С. ;486 р.;486 р.
Возраст не причина для старости. Секреты долголетия ...;Божьев Е. Н. ;164 р.;164 р.
Искусство жить. Секреты долголетия от 105-летнего врача;Хинохара С. ;329 р.;329 р.
Еда для вашего характера. Выберите свой метод для ст...;Бодрова А. В. ;250 р.;250 р.
Японская система оздоровления. Метод Фукуцудзи;Фукуцудзи Т. ;415 р.;415 р.
Три ключа к здоровью. Питание, очищение, закаливание;Советов М. В. ;330 р.;330 р.
Другое тело. Программа стройности для мужчин и женщи...;Пономаренко  А. А. ;250 р.;250 р.
Японская система стройности «Похудей-дом»;Симидзу Р. ;295 р.;295 р.
100 мифов о еде и врЕДЕ;Гичев Ю. Ю. ;156 р.;156 р.
Диетология. 5-е изд.;Барановский А. Ю. ;4392 р.;4392 р.
Камертон для организма. Домашняя физиотерапия;Киршов  В. А. ;168 р.;168 р.
Календарь долголетия по Болотову на 2019 год;Болотов Б. В. ;93 р.;93 р.
Дневник здоровья;Советов М. В. ;;
Три ключа к здоровью. Питание, очищение, закаливание;Советов М. В. ;250 р.;250 р.
История развития ребенка;Савко Л. М. ;258 р.;258 р.
Медицинская карта ребенка для образовательных учрежд...; ;90 р.;90 р.
Гипертония. Причины, профилактика, лечение;Савко Л. М. ;118 р.;118 р.
Артрит и артроз. Советы врача;Рудницкая Л. ;105 р.;105 р.
Книга жизни. Для тех, кто отчаялся найти врачей, кот...;Божьев Е. Н. ;256 р.;256 р.
Еда по законам природы. Путь к естественному питанию;Советов М. В. ;264 р.;264 р.
Аллергошкола для мам;Большакова А. М. ;249 р.;249 р.
Скандинавский секрет. Простые правила здоровой и сча...;Марклунд Б. ;187 р.;187 р.
Сахарный человек. Все, что вы хотели знать о сахарно...;Авторский коллектив ;798 р.;798 р.
Рецепты Болотова на каждый день. Календарь на 2018 год;Болотов Б. В. ;14 р.;14 р.
Лечебная гимнастика для сосудов. Советы врача;Рудницкая Л. ;118 р.;118 р.
Лечебная гимнастика для позвоночника. Советы врача;Рудницкая Л. ;114 р.;114 р.
Исповедь бывших толстушек. Диета доктора Миркина;Миркин В. И. ;119 р.;119 р.
Инсульт. Жизнь до и после;Крулев К. А. ;96 р.;96 р.
Рецепты зеленых коктейлей для России;Бутенко В. В. ;153 р.;153 р.
Болезни сильных людей, или Как обуздать желчь?;Чойжинимаева С. Г. ;104 р.;104 р.
Болезни нервных людей, или Откуда дует ветер?;Чойжинимаева С. Г. ;128 р.;128 р.
Болезни больших людей, или Что такое слизь?;Чойжинимаева С. Г. ;125 р.;125 р.
Золотые китайские упражнения для здоровья и долголетия;Чжун Б. ;88 р.;88 р.
Очищение кишечника;Рудницкая Л ;79 р.;79 р.
Забудьте слово «диета».  Почему мы любим вредное, см...;Гичев Ю. Ю. ;156 р.;156 р.
Очищение сосудов; ;79 р.;79 р.
Очищение печени и почек;Садов А. В. ;67 р.;67 р.
Карманный счетчик калорий, жиров и углеводов;Лужковская Ю. ;80 р.;80 р.
Грыжа позвоночника. Лечение и профилактика;Садов А. В. ;79 р.;79 р.
Чеснок для лечения и очищения; ;66 р.;66 р.
Хрен для лечения и очищения; ;66 р.;66 р.
Скипидарные ванны для лечения и очищения. Учение Зал...;Мазур О. А. ;67 р.;67 р.
Лечебная сила воды. Секреты индийских мудрецов;Моханти Р. ;72 р.;72 р.
Болезни глаз: глаукома и катаракта. Карманный справо...;Рудницкий Л. В. ;98 р.;98 р.
Лечебная сила магнита. Секреты индийских мудрецов;Моханти Р. ;62 р.;62 р.
Тибетская медицина: единство тела, разума и духа. О ...;Чойжинимаева С. Г. ;170 р.;170 р.
Дневник первых слов ребенка;Савко Л. М. ;205 р.;205 р.
Правила здоровья и долголетия от академика Болотова;Погожева Л. И. ;67 р.;67 р.
Медицинская карта ребенка;Салова О. В. ;64 р.;64 р.
Дневник будущей мамы. Беременность день за днем;Свирская Е. В. ;174 р.;174 р.
Здоровье вашего ребенка. Книга для разумных родителей;Староверов Ю. И. ;287 р.;287 р.
О чем говорят анализы;Рудницкий Л. В. ;79 р.;79 р.
Холестерин. Как победить атеросклероз?;Фадеева А ;61 р.;61 р.
Сердечно-сосудистые заболевания. Карманный справочник;Крулев К. А. ;85 р.;85 р.
Аптека здоровья по Болотову;Болотов Б. В. ;78 р.;78 р.
Справочник гипертоника;Савко Л. М. ;61 р.;61 р.
Карманный справочник медицинских анализов;Рудницкий Л. В. ;91 р.;91 р.
9 месяцев день за днем;Савко Л. М. ;161 р.;161 р.
Грибы против рака;Филиппова И. А. ;25 р.;25 р.
Чага. Гриб-сенсация;Филиппова И. А. ;69 р.;69 р.
Пять шагов к бессмертию;Болотов Б. В. ;79 р.;79 р.
Здоровье человека в нездоровом обществе. Авторская р...;Болотов Б. В. ;170 р.;170 р.
Живая и мертвая вода — совершенное лекарство;Кородецкий А. ;45 р.;45 р.
Отложение солей. Диагностика и лечение;Ольшанская Е С ;25 р.;25 р.
Народный лечебник Болотова;Болотов Б. В. ;94 р.;94 р.
Рецепты бабушки Травинки;Травинка (Петрова) В. М. ;52 р.;52 р.
Рецепты Болотова на каждый день. Календарь на 2014 год;Болотов Б. В. ;57 р.;57 р.
Исцеляющая и омолаживающая баня по Болотову;Болотов Б. В. ;17 р.;17 р.
Зеленая энциклопедия здоровья. Лучшие рецепты нетрад...;Болотов Б. В. ;117 р.;117 р.
Лечение ферментами и соками по Болотову;Болотов Б. В. ;79 р.;79 р.
Пять шагов к бессмертию;Болотов Б. В. ;65 р.;65 р.
Лечение сердечно-сосудистой системы по Болотову;Болотов Б. В. ;60 р.;60 р.
Лечение желудочно-кишечного тракта по Болотову;Болотов Б. В. ;60 р.;60 р.
Что показывает кардиограмма;Салова О. В. ;40 р.;40 р.
Легко родить легко. Пособие для будущих мам;Осоченко Е. В. ;78 р.;78 р.
Аптека здоровья по Болотову;Болотов Б. В. ;78 р.;78 р.
Здоровье человека в нездоровом обществе. Авторская р...;Болотов Б. В. ;161 р.;161 р.
Я беременна! Что вас ждет, и о чем вас никто не пред...;Фофанова Н. ;17 р.;17 р.
Исцеляющая тайна воды за семью замками;Гарбузов Г. А. ;17 р.;17 р.
Повышение иммунитета и регенерация тканей по Болотову;Болотов Б. В. ;65 р.;65 р.
Беременность от зачатия до родов;Свирская Е. В. ;99 р.;99 р.
Болезни глаз излечимы методами нетрадиционной медицины;Рудницкий Л. ;7 р.;7 р.
Беременность день за днем. Дневник будущей мамы;Свирская Е. В. ;50 р.;50 р.
Золотые рецепты здоровья и долголетия;Болотов Б. В. ;10 р.;10 р.
Планируем  ребенка. Все, что необходимо знать молоды...;Башкирова Н. А. ;36 р.;36 р.
Холестерин. Как победить атеросклероз?;Фадеева А ;58 р.;58 р.
Зеленая энциклопедия здоровья. Лучшие рецепты нетрад...;Болотов Б. В. ;47 р.;47 р.
Цигун для глаз;Бинь Чжун ;149 р.;149 р.
Рак можно победить! Ловушка для раковых клеток;Гарбузов Г. А. ;91 р.;91 р.
Гимнастика для будущей мамы и малыша;Дан О. В. ;16 р.;16 р.
Антиоксидантное лечение рака;Гарбузов Г. А. ;18 р.;18 р.
Программа здорового питания академика Болотова;Болотов Б. В. ;99 р.;99 р.
Золотые китайские упражнения для здоровья и долголетия;Чжун Б. ;17 р.;17 р.
Скажи опухоли «нет»!;Гарбузов Г. А. ;6 р.;6 р.
Лучшие методики очищения по Болотову; ;12 р.;12 р.
Лечение желудочно-кишечного тракта по Болотову;Болотов Б. В. ;62 р.;62 р.
Ежедневник ЗОЖ: гимнастика, питание, голодание, очищ...;Якуба А. В. ;158 р.;158 р.
Лечение сердечно-сосудистой системы по Болотову;Болотов Б. В. ;62 р.;62 р.
Сода, зеленый кофе, имбирь для похудения; ;60 р.;60 р.
Псориаз. Диета, лечение, профилактика;Салова О. В. ;74 р.;74 р.
Оружие против близорукости;Фадеева А ;28 р.;28 р.
Универсальный карманный справочник медицинских препа...;Ризо  Е. А. ;115 р.;115 р.
Здоровая беременность и естественные роды: современн...;Кублицкая И. В. ;57 р.;57 р.
Массаж при болях в спине (+CD c видеокурсом);Жданов А. И. ;177 р.;177 р.
Худеем во сне. Биоритмы стройности;Климова В ;17 р.;17 р.
Чистка суставов. Современные и традиционные методы;Рудницкая Л ;63 р.;63 р.
Живая вода. Секреты клеточного омоложения и похудения;Рудницкая Л. ;52 р.;52 р.
Лечение ферментами и соками по Болотову;Болотов Б. В. ;82 р.;82 р.
Молодость навсегда. 100 способов сохранить молодость...;Садокова Е. П. ;80 р.;80 р.
Топографическая анатомия и оперативная хирургия для ...;Лебедев В. А. ;248 р.;248 р.
Коррекция зрения у детей: практический курс;Троицкая С. И. ;31 р.;31 р.
Современная офтальмология: Руководство. 2-е изд.;Даниличев В. Ф. ;148 р.;148 р.
Оториноларингология: Руководство. Том 2;Бабияк В. И. ;140 р.;140 р.
Антицеллюлитный самомассаж;Васичкин В. И. ;19 р.;19 р.
Оториноларингология: Руководство. Том 1;Бабияк В. И. ;140 р.;140 р.
Лечебный массаж внутренних органов;Лужковская Ю. ;59 р.;59 р.
Лечение по Болотову: ферменты, уксусы, квасы;Болотов Б. В. ;78 р.;78 р.
Исцеляющая дыхательная гимнастика;Зинатулин С. Н. ;25 р.;25 р.
Сифилис. 3-е изд.;Родионов А. Н. ;38 р.;38 р.
Родить здорового малыша без боли и страха;Макарова Е. В. ;18 р.;18 р.
Голубая целительница глина. 3-е изд.;Травинка (Петрова) В. М. ;52 р.;52 р.
Боль в спине. Как определить причину и устранить при...;Евдокимова А. ;30 р.;30 р.
Деменция;Чухловина М. Л. ;42 р.;42 р.
Как бросить. . .есть! И начать жить!;Миркин В. И. ;48 р.;48 р.
Худеем быстро и легко. Минус 5 размеров за 5 месяцев!;Миркин В. И. ;28 р.;28 р.
Современные хирургические инструменты. 2-е изд.;Семенов Г. М. ;304 р.;304 р.
Расти здоровым, малыш!;Русакова Е. М. ;78 р.;78 р.
Омолаживающая диета;Лужковская Ю. ;39 р.;39 р.
Как восстановить фигуру после родов (+СD с видеокурсом);Капская В. ;46 р.;46 р.
Биолокация и биоэнергетика — спасение от болезней века!;Горячев В. В. ;26 р.;26 р.
Сохранить здоровье ребенка. Как?;Христолюбова В ;5 р.;5 р.
Как восстановить и сохранить зрение у ребенка;Кислинская Т. А. ;32 р.;32 р.
Школа молодых родителей (+DVD с видеокурсом);Жукова Е ;118 р.;118 р.
Вредные товары;Рудницкий Л. ;18 р.;18 р.
Очищение и голодание по системе йогов;Громаковская Т А ;27 р.;27 р.
Диета для работы мозга. Что есть, чтобы хорошо сообр...;Лужковская Ю. ;27 р.;27 р.
Йога. Большая книга лучших асан (+СD с видеокурсом)....;Липень А. А. ;332 р.;332 р.
Бодифлекс. Большая книга лучших упражнений для похуд...;Светлова Л. ;86 р.;86 р.
Остеохондроз. Лечение и профилактика;Фадеева А ;25 р.;25 р.
Думай правильно, худей без усилий;Стил Т. ;30 р.;30 р.
Полное очищение организма по Малахову;Кородецкий А ;18 р.;18 р.
Эко-кулинария: живая кухня. Умное сыроедение;Бидлингмайер А ;126 р.;126 р.
Карманный счетчик калорий;Лужковская Ю. ;52 р.;52 р.
Рыдающее дыхание излечивает сердечно-сосудистые забо...;Вилунас Ю. Г. ;71 р.;71 р.
Ионы водорода лечат рак;Гарбузов Г. А. ;87 р.;87 р.
Как избавить ребенка от лишнего веса;Макарова Е. В. ;27 р.;27 р.
Едим и худеем. Ежедневная программа питания на месяц;Стил Т. ;84 р.;84 р.
Семидневная цветная диета;Дан О ;29 р.;29 р.
Оздоровление при помощи восточных практик (+DVD);Буланов Л. А. ;77 р.;77 р.
Лечение позвоночника и суставов. Долголетие и здоровье;Буланов Л. А. ;46 р.;46 р.
Естественное очищение суставов и кожи по Малахову;Кородецкий А. ;16 р.;16 р.
