Title;Author;Price;Url
Война после Победы. Бандера и Власов: приговор без с...;Гаспарян А. С. ;288 р.;288 р.
Ложь Посполита. Питер покет;Гаспарян А. С. ;288 р.;288 р.
Тайна личности Ленина. Питер покет;Гаспарян А. С. ;288 р.;288 р.
Убить Сталина. Реальные истории покушений и заговоро...;Гаспарян А. С. ;288 р.;288 р.
Россия в огне Гражданской войны. Питер покет;Гаспарян А. С. ;288 р.;288 р.
Россия и Германия. Друзья или враги? Питер покет;Гаспарян А. С. ;288 р.;288 р.
ДеНАЦИфикация Украины. Питер покет;Гаспарян А. С. ;431 р.;431 р.
Крах великой империи: загадочная история самой крупн...;Гаспарян А. С. ;431 р.;431 р.
"Комплект: Средневековая Русь + ""Рим"".мир сериала"; ;1414 р.;1414 р.
Комплект: Солдат императора + Дед; ;1169 р.;1169 р.
Комплект: Огонь, дрова, мясо + Трусливый ястреб; ;1180 р.;1180 р.
Комплект: Война на уничтожение + Русско-японская война; ;910 р.;910 р.
Комплект: Война на уничтожение + Инцидент; ;910 р.;910 р.
Комплект: Викинги. История эпохи + Вехи русской истории; ;591 р.;591 р.
Интимные места Фортуны (Питер покет);Мэннинг Ф. ;431 р.;431 р.
Деды и прадеды (Питер покет);Конаныхин Д. А. ;431 р.;431 р.
"""ГESS"" Тайный план Черчилля (Питер покет)";Сосновский А. ;466 р.;466 р.
За пределами разума: что мы думаем и как мы к этому ...;Фернандес-Арместо Ф. ;1194 р.;1194 р.
Сожжение книг;Овенден Р. ;1194 р.;1194 р.
Первая война за иракскую нефть. Месопотамский театр ...;Копылов К. Ю. ;815 р.;815 р.
Америка: Без царя в голове;Злобин Н. В. ;839 р.;839 р.
Интимные места Фортуны;Мэннинг Ф. ;828 р.;828 р.
Непобедимый. Жизнь и сражения Александра Суворова. Ч...;Кипнис Б. Г. ;249 р.;249 р.
Современный фашизм. Предисловие Дмитрий GOBLIN Пучко...;Жуков К. А. ;99 р.;99 р.
Непобедимый. Жизнь и сражения Александра Суворова. Ч...;Кипнис Б. Г. ;249 р.;249 р.
СВЕЖЕОТБЫВШИЕ на тот свет;Лимонов Э. В. ;335 р.;335 р.
Полное собрание стихотворений и поэм. В 4 томах. Том 1;Лимонов Э. В. ;2880 р.;2880 р.
Страна пирамид. Новейшие открытия археологов в Египте;Лебедев М. А. ;1199 р.;1199 р.
Забытые гробницы. Тайны древнеегипетского некрополя;Лебедев М. А. ;1199 р.;1199 р.
Шуры-муры на Калининском;Рождественская Е. Р. ;719 р.;719 р.
Солдат императора;Жуков К. А. ;1079 р.;1079 р.
Непобедимый. Жизнь и сражения Александра Суворова;Кипнис Б. Г. ;1374 р.;1374 р.
Дед;Жуков К. А. ;599 р.;599 р.
Инцидент;Жуков К. А. ;563 р.;563 р.
Первая семья: Джузеппе Морелло и зарождение американ...;Дэш М. ;839 р.;839 р.
Война на уничтожение. Третий рейх и геноцид советско...;Яковлев Е. Н. ;840 р.;840 р.
Большая политика TOPLESS;Беляк С. В. ;780 р.;780 р.
Неностальгическая антисоветская книга;Максимов А. М. ;712 р.;712 р.
Трусливый ястреб. Предисловие Дмитрий GOBLIN Пучков ...; ;647 р.;647 р.
Трусливый ястреб. Предисловие Дмитрий GOBLIN Пучков; ;399 р.;399 р.
Идеология русской государственности. Континент Росси...;Сергейцев Т. Н. ;399 р.;399 р.
Народы России. ДНК-генеалогия;Клёсов А. А. ;599 р.;599 р.
Троцкий, Сталин, коммунизм;Сарабеев В. Ю. ;1152 р.;1152 р.
Белый террор. Гражданская война в России. 1917-1920 гг.;Ратьковский И. С. ;1020 р.;1020 р.
Викинги. История эпохи: 793-1066 гг. Предисловие Дми...;Жуков К. А. ;399 р.;399 р.
Американская империя. Прогноз 2020-2030 гг.;Фридман Д. ;399 р.;399 р.
Казино. Любовь и власть в Лас-Вегасе. Предисловие Дм...;Пиледжи Н. ;606 р.;606 р.
Идеология русской государственности. Континент Росси...;Сергейцев Т. Н. ;399 р.;399 р.
Идеология русской государственности. Континент Росси...;Сергейцев Т. Н. ;399 р.;399 р.
Боевая экология. Как Greenpeace, WWF и другие междун...;Гафуров С. З. ;299 р.;299 р.
Средневековая Русь: от призвания варягов до принятия...;Жуков К. А. ;349 р.;349 р.
Идеология русской государственности. Континент Россия;Сергейцев Т. Н. ;319 р.;319 р.
Лис Севера. Большая стратегия Владимира Путина (ауди...;Казаков А. ;272 р.;272 р.
Испанская дивизия – союзник Третьего рейха. 1941-194...;Ковалев Б. Н. ;653 р.;653 р.
Огонь, дрова, мясо. Дмитрий Goblin Пучков;GOBLIN ;1090 р.;1090 р.
Ледовый поход Балтийского флота. Кораблекрушение в м...;Назаренко К. Б. ;720 р.;720 р.
Чернобыльская тетрадь. Документальное расследование ...;Медведев Г. У. ;349 р.;349 р.
Средневековая Русь: от призвания варягов до принятия...;Жуков К. А. ;546 р.;546 р.
Адмирал Колчак. Протоколы допроса (аудиокнига); ;349 р.;349 р.
Пенсионная реформа и рабочее время. Предисловие Дмит...;Попов М. В. ;217 р.;217 р.
«Рим». Мир сериала;Жуков К. А. ;1306 р.;1306 р.
Лис Севера. Большая стратегия Владимира Путина;Казаков А. Ю. ;1020 р.;1020 р.
Эпоха мертворожденных. Антиутопия, ставшая реальност...;Бобров Г. Л. ;690 р.;690 р.
Древняя Русь. От Рюрика до Батыя. Предисловие Дмитри...;Жуков К. А. ;349 р.;349 р.
Философия подвига;Лимонов Э. В. ;424 р.;424 р.
Чернобыльская тетрадь. Документальное расследование;Медведев Г. У. ;412 р.;412 р.
Болезнь, подарившая жизнь;Хорошунова Т. ;565 р.;565 р.
Суси-нуар 2. Зомби нашего века. Занимательное мурака...;Коваленин Д. В. ;522 р.;522 р.
Суси-нуар 1.Х. Занимательное муракамиЕдение от «Слуш...;Коваленин Д. В. ;522 р.;522 р.
Великая аграрная реформа. От рабства до НЭПа. Предис...;Прудникова Е. А. ;197 р.;197 р.
Русская Арктика: лед, кровь и пламя. Предисловие Дми...;Дмитрий Goblin Пучков ;593 р.;593 р.
Неизвестная война. Записки военного разведчика;Карцев А. И. ;422 р.;422 р.
Норд-Ост. Заложники на Дубровке. Предисловие Дмитрий...;Дюков А. Р. ;249 р.;249 р.
Друг государства. Гении и бездарности, изменившие хо...;Яковлев Е. Н. ;199 р.;199 р.
Древняя Русь. От Рюрика до Батыя. Предисловие Дмитри...;Жуков К. А. ;299 р.;299 р.
Под Андреевским и Красным флагом:Русский флот в Перв...;Назаренко К. Б. ;527 р.;527 р.
Добро пожаловать в Пхеньян! Ким Чен Ын и новая жизнь...; ;593 р.;593 р.
В тени истории. 33 способа остаться в веках, не прив...;Карасюк Д. Ю. ;449 р.;449 р.
ДНК-генеалогия славян: происхождение и история;Клёсов А. А. ;349 р.;349 р.
Польша: гиена Восточной Европы. Предисловие Дмитрий ...;Пыхалов И. В. ;199 р.;199 р.
За что сражались советские люди. Предисловие Дмитрий...;Дюков А. Р. ;363 р.;363 р.
Русское психо;Лимонов Э. В. ;249 р.;249 р.
Финляндия: государство из царской пробирки. Предисло...;Пыхалов И. В. ;199 р.;199 р.
Азбука. «Император» и другие мнения;Лимонов Э. В. ;522 р.;522 р.
Ненависть. Хроники русофобии (аудиокнига);Стариков Н. В. ;199 р.;199 р.
Поваренная книга насекомых. Стихотворения;Лимонов Э. В. ;199 р.;199 р.
Императорская Россия;Анисимов Е. В. ;1823 р.;1823 р.
#Мы никогда не знаем...;Оганова И. Б. ;480 р.;480 р.
По главному фарватеру эпохи. От последнего паруса до...;Дмитрий Goblin Пучков ;407 р.;407 р.
Будни революции. 1917 год;Светенко А. С. ;419 р.;419 р.
Палач (роман);Лимонов Э. В. ;671 р.;671 р.
Государство чести. Монархия - будущее России;Шафран А. ;396 р.;396 р.
"316, пункт ""В""";Лимонов Э. В. ;354 р.;354 р.
Эпоха застоя. Как это было?;Гаспарян А. С. ;191 р.;191 р.
Перестройка. Как это было?;Гаспарян А. С. ;191 р.;191 р.
Оттепель. Как это было?;Гаспарян А. С. ;191 р.;191 р.
Лекции о будущем. Мрачные пророчества;Лимонов Э. В. ;372 р.;372 р.
Как нас обманывают СМИ. Манипуляция информацией. Пре...;Ильченко С. Н. ;199 р.;199 р.
Битва трех императоров. Наполеон, Россия и Европа. 1...;Соколов О. В. ;449 р.;449 р.
Словарь патриота Отечества. С предисловием Николая С...;Стариков Н. В. ;260 р.;260 р.
Священные монстры;Лимонов Э. В. ;345 р.;345 р.
Эхо войны. Неудобная  правда.;Гаспарян А. С. ;191 р.;191 р.
Экономика. Закат либерализма. Предисловие Дмитрий GO...;Попов М. В. ;179 р.;179 р.
Русская контрреволюция. Белые от Ростова до Парижа;Гаспарян А. С. ;407 р.;407 р.
Вожди и лидеры. Как это было?;Гаспарян А. С. ;191 р.;191 р.
Войны конца Российской империи. Предисловие Дмитрий ...;Юлин Б. В. ;384 р.;384 р.
Революция 1917 года. Как это было?;Гаспарян А. С. ;49 р.;49 р.
Порванные души. Снайпер в Афгане. Предисловие Дмитри...;Бобров Г. Л. ;719 р.;719 р.
Громче, чем тишина. Первая  в Росcии книга о семейно...;Спиваковская В. ;359 р.;359 р.
Ненависть. Хроники русофобии;Стариков Н. В. ;419 р.;419 р.
Мы...их! С предисловием Николая Старикова;Хелемендик С. В. ;312 р.;312 р.
Короткие истории о любви и нелюбви. Сборник стихов;Киселева Л. ;199 р.;199 р.
Курильский пинг-понг. 100 лет борьбы за острова;Кошкин А. А. ;419 р.;419 р.
Контрольный выстрел;Лимонов Э. В. ;335 р.;335 р.
Сталин. Цена успеха, феномен пропаганды.;Громов А. Б. ;372 р.;372 р.
Нацизм. Предисловие Дмитрий GOBLIN Пучков (покет);Дмитрий Goblin Пучков ;99 р.;99 р.
Русофобия. С предисловием Николая Старикова;Ильин А. Н. ;359 р.;359 р.
Дурные дети Перестройки;Шаманов К. ;419 р.;419 р.
Бородино: Стоять и умирать! Предисловие Дмитрий GOBL...;Юлин Б. В. ;199 р.;199 р.
Хорошо, когда хорошо! Хроника сибаритства;Беляк С. В. ;420 р.;420 р.
После Путина;Долгов К. Г. ;323 р.;323 р.
Коротко и жутко. Военкор Стешин;Стешин Д. А. ;318 р.;318 р.
Ложь Посполита;Гаспарян А. С. ;659 р.;659 р.
Убийство в Ворсхотене;Корнилов В. В. ;299 р.;299 р.
Мои живописцы;Лимонов Э. В. ;349 р.;349 р.
Вехи русской истории (аудиокнига);Юлин Б. В. ;199 р.;199 р.
Государственный язык как орудие власти. С предислови...;Рыбин В. В. ;359 р.;359 р.
Война на уничтожение (аудиокнига);Яковлев Е. Н. ;199 р.;199 р.
Вован и Лексус. По ком звонит телефон (аудиокнига);Кузнецов В. А. ;260 р.;260 р.
The Liquidation of Russia. Who Helped the Reds to Wi...;Стариков Н. В. ;606 р.;606 р.
"1917. Key to the ""Russian"" Revolution";Стариков Н. В. ;708 р.;708 р.
Под знамёнами демократии. Войны и конфликты на разва...;Норин Е. А. ;275 р.;275 р.
Вован и Лексус. По ком звонит телефон;Кузнецов В. А. ;312 р.;312 р.
Монголия;Лимонов Э. В. ;299 р.;299 р.
Русско-японская война 1904 - 1905гг. Потомки последн...;Юлин Б. В. ;359 р.;359 р.
Мой друг Карлос Шакал. Революционер, ставший героем ...;Молотов И. ;359 р.;359 р.
Первые Романовы: жажда власти и любви (покет);Сукина Л. Б. ;;
ДеНАЦИфикация Украины. Страна невыученных уроков;Гаспарян А. С. ;659 р.;659 р.
Необъявленная война. Россия в огненном кольце;Егорченков Д. А. ;419 р.;419 р.
Геополитика и предчувствие войны. Удар по России;Коровин В. М. ;348 р.;348 р.
Вехи русской истории. Предисловие Дмитрий GOBLIN Пучков;Юлин Б. В. ;311 р.;311 р.
Тринадцатая ночь. Роман-гипотеза;Кредов С. А. ;77 р.;77 р.
Миропорядок по-русски;Уралов С. С. ;320 р.;320 р.
Так говорил Сталин (покет);Стариков Н. , составитель  .  . ;203 р.;203 р.
1941-1945. Оболганная война;Гаспарян А. С. ;271 р.;271 р.
Донецко-Криворожская республика. Расстрелянная мечта...;Корнилов В. В. ;712 р.;712 р.
"Операция ""Трест"". Шпионский маршрут Москва — Берлин ...";Гаспарян А. С. ;285 р.;285 р.
Война на уничтожение. Что готовил Третий Рейх для Ро...;Яковлев Е. Н. ;199 р.;199 р.
Приключения парня из белорусской деревни,  который  ...;Левшенко В. Т. ;312 р.;312 р.
Война после Победы. Бандера и Власов: приговор без с...;Гаспарян А. С. ;266 р.;266 р.
Генерал Скоблин: Легенда советской разведки;Гаспарян А. С. ;601 р.;601 р.
Книга, которой нет. Как бросить беличье колесо и стр...;Новак А. ;149 р.;149 р.
Переворот;Филимонов Г. Ю. ;199 р.;199 р.
Турецкий капкан: 100 лет спустя;Олейников А. В. ;199 р.;199 р.
Новая Россия. Какое будущее нам предстоит построить;Делягин М. Г. ;299 р.;299 р.
Российские изобретатели 21 века;Гугнин В. А. ;632 р.;632 р.
Новые способы ведения войны: Как Америка строит империю;Савин Л. В. ;249 р.;249 р.
Два капитала: как экономика втягивает Россию в войну;Уралов С. С. ;342 р.;342 р.
Факел Новороссии;Губарев П. Ю. ;199 р.;199 р.
Россия на пути к империи;Коровин В. ;299 р.;299 р.
Дневник русского украинца: Евромайдан, крымская весн...;Беседин Платон ;199 р.;199 р.
Конец проекта «Украина»;Коровин В. М. ;30 р.;30 р.
Как я изобретал мир;Сименс В. ф. ;499 р.;499 р.
Минус один? Плюс один! Приемный ребенок в семье;Петрановская Л. В. ;350 р.;350 р.
Правильное общество;Липатов А. А. ;299 р.;299 р.
Императорская Россия;Анисимов Е. В. ;1031 р.;1031 р.
Уши машут ослом. Современное социальное программиров...;Хазеев Р. ;309 р.;309 р.
Белая Церковь: Вдали от атеистического террора;Маковецкий А. В. ;22 р.;22 р.
Орден СС. Иезуиты империи. О чем не принято говорить;Кормилицын С. В. ;34 р.;34 р.
Троянский конь западной истории;Беляков А. ;235 р.;235 р.
Удар по России. Геополитика и предчувствие войны;Коровин В. М. ;237 р.;237 р.
Так говорил Сталин;Стариков Н. , составитель  .  . ;199 р.;199 р.
Информационная война против России;Ткаченко С. В. ;47 р.;47 р.
Кто и куда ведет Россию? От харизмы до маразма;Фортунатов В. В. ;15 р.;15 р.
Будущее России. Алгоритм переворота;Бобраков О. А. ;67 р.;67 р.
Надо ли России бояться Китая?;Беззубцев-Кондаков А. Е. ;48 р.;48 р.
2012 год. Версии и факты;Панин В. ;34 р.;34 р.
Березовский — не своя игра;Чекулин Н. С. ;48 р.;48 р.
Страсти по власти: от Ленина до Путина;Пазин М. С. ;99 р.;99 р.
Россия в 2017 году. Чем закончатся эксперименты со с...;Фортунатов В. В. ;53 р.;53 р.
